{
  "$schema": "https://json-schema.org/draft/2020-12/schema",
  "$id": "https://uchar.dev/schema/uchar-case-v0.schema.json",
  "title": "uchar corpus case, format uchar-case-v0",
  "description": "One golden-corpus evaluation case: the input world, the evaluation date, parameter values, and the expected outcomes. Engine-neutral; consumed by the reference interpreter and any conforming backend harness. Values are unit-normalised to the referenced declaration's unit; numbers are exact decimal or rational lexemes carried as strings, never JSON floats.",
  "type": "object",
  "additionalProperties": false,
  "required": ["format", "asOfDate", "input"],
  "oneOf": [
    { "required": ["expected"], "not": { "required": ["expectedFault"] } },
    { "required": ["expectedFault"], "not": { "required": ["expected"] } }
  ],
  "properties": {
    "format": { "const": "uchar-case-v0" },
    "asOfDate": {
      "description": "The single evaluation date (valuation = calculation = vintage selection); null for a time-free case.",
      "oneOf": [ { "type": "string", "pattern": "^[0-9]{4}-[0-9]{2}-[0-9]{2}$" }, { "type": "null" } ]
    },
    "input": {
      "type": "object",
      "additionalProperties": false,
      "required": ["instances", "parameters"],
      "properties": {
        "instances": {
          "type": "array",
          "items": { "$ref": "#/$defs/instance" }
        },
        "parameters": {
          "description": "Parameter name (as declared) to value, in the parameter's declared unit. A granular parameter may carry its full timeline (the timeline variant).",
          "type": "object",
          "additionalProperties": { "oneOf": [ { "$ref": "#/$defs/value" }, { "$ref": "#/$defs/timelineValue" } ] }
        }
      }
    },
    "expected": {
      "type": "array",
      "minItems": 1,
      "items": { "$ref": "#/$defs/expectation" }
    },
    "expectedFault": {
      "description": "The red-path alternative to `expected` (corpus/rood): evaluation of this case MUST fail observably in every executor — never a silent skip, never a model. Each field is a substring the executor's fault report must contain: `ref` against the reference interpreter's fault, `clingo` against the ASP runner's fault or UNSAT report. A case carries exactly one of `expected` / `expectedFault`.",
      "type": "object",
      "additionalProperties": false,
      "required": ["ref", "clingo"],
      "properties": {
        "ref": { "type": "string", "minLength": 1 },
        "clingo": { "type": "string", "minLength": 1 }
      }
    }
  },
  "$defs": {
    "instance": {
      "type": "object",
      "additionalProperties": false,
      "required": ["label", "objectType", "attributes", "roles", "characteristics"],
      "properties": {
        "label": {
          "description": "Case-local instance name; unique within the case; the handle role links and expectations use.",
          "type": "string",
          "minLength": 1
        },
        "objectType": { "type": "string", "minLength": 1 },
        "attributes": {
          "description": "Attribute name (as declared) to value, in the attribute's declared unit. Absence means empty (leeg); an input never carries an explicit empty. A temporal attribute carries either the asOfDate-bucket scalar or its full timeline (the timeline variant) — never both meanings at once.",
          "type": "object",
          "additionalProperties": { "oneOf": [ { "$ref": "#/$defs/value" }, { "$ref": "#/$defs/timelineValue" } ] }
        },
        "roles": {
          "description": "Role name (as declared) to the labels of the linked instances; a to-one role carries exactly one label.",
          "type": "object",
          "additionalProperties": {
            "type": "array",
            "minItems": 1,
            "items": { "type": "string", "minLength": 1 }
          }
        },
        "characteristicTimelines": {
          "description": "Full timelines of temporal characteristics: per declared temporal characteristic the true-periods, day-precision, from inclusive / to exclusive, ordered and non-overlapping, aligned to the declaration's granularity grid. Absence of a period means the characteristic does not hold there (a gap is clipped away, never leeg).",
          "type": "object",
          "additionalProperties": {
            "type": "array",
            "minItems": 1,
            "items": {
              "type": "object", "additionalProperties": false, "required": ["from", "to"],
              "properties": {
                "from": { "type": "string", "pattern": "^[0-9]{4}-[0-9]{2}-[0-9]{2}$" },
                "to": { "type": "string", "pattern": "^[0-9]{4}-[0-9]{2}-[0-9]{2}$" }
              }
            }
          }
        },
        "characteristics": {
          "description": "Characteristics asserted true on input; every other characteristic starts false.",
          "type": "array",
          "items": { "type": "string", "minLength": 1 }
        }
      }
    },
    "value": {
      "description": "A typed value; exactly one variant.",
      "oneOf": [
        {
          "type": "object", "additionalProperties": false, "required": ["number"],
          "properties": {
            "number": {
              "description": "Exact decimal (dot) or rational (a/b) lexeme.",
              "type": "string",
              "pattern": "^-?[0-9]+(\\.[0-9]+)?$|^-?[0-9]+/[1-9][0-9]*$"
            }
          }
        },
        {
          "type": "object", "additionalProperties": false, "required": ["date"],
          "properties": { "date": { "type": "string", "pattern": "^[0-9]{4}-[0-9]{2}-[0-9]{2}$" } }
        },
        {
          "type": "object", "additionalProperties": false, "required": ["dateTime"],
          "properties": { "dateTime": { "type": "string", "pattern": "^[0-9]{4}-[0-9]{2}-[0-9]{2}T[0-9]{2}:[0-9]{2}:[0-9]{2}(\\.[0-9]{3})?$" } }
        },
        {
          "type": "object", "additionalProperties": false, "required": ["boolean"],
          "properties": { "boolean": { "type": "boolean" } }
        },
        {
          "type": "object", "additionalProperties": false, "required": ["text"],
          "properties": { "text": { "type": "string" } }
        },
        {
          "type": "object", "additionalProperties": false, "required": ["enumeration"],
          "properties": { "enumeration": { "type": "string", "minLength": 1 } }
        }
      ]
    },
    "timelineValue": {
      "description": "A full timeline: day-precision segments, from inclusive, to exclusive, ordered and non-overlapping, aligned to the declaration's granularity grid; absence between segments is a gap (leeg on read). The ref loader owns the cross-checks.",
      "type": "object", "additionalProperties": false, "required": ["timeline"],
      "properties": {
        "timeline": {
          "type": "array",
          "minItems": 1,
          "items": {
            "type": "object", "additionalProperties": false, "required": ["from", "to", "value"],
            "properties": {
              "from": { "type": "string", "pattern": "^[0-9]{4}-[0-9]{2}-[0-9]{2}$" },
              "to": { "type": "string", "pattern": "^[0-9]{4}-[0-9]{2}-[0-9]{2}$" },
              "value": { "$ref": "#/$defs/value" }
            }
          }
        }
      }
    },
    "expectation": {
      "oneOf": [
        {
          "type": "object", "additionalProperties": false,
          "required": ["kind", "label", "attribute", "value"],
          "properties": {
            "kind": { "const": "attributeValue" },
            "label": { "type": "string", "minLength": 1 },
            "attribute": { "type": "string", "minLength": 1 },
            "value": { "$ref": "#/$defs/value" }
          }
        },
        {
          "type": "object", "additionalProperties": false,
          "required": ["kind", "label", "attribute"],
          "properties": {
            "kind": { "const": "attributeEmpty" },
            "label": { "type": "string", "minLength": 1 },
            "attribute": { "type": "string", "minLength": 1 }
          }
        },
        {
          "type": "object", "additionalProperties": false,
          "required": ["kind", "label", "attribute", "timeline"],
          "properties": {
            "kind": { "const": "attributeTimeline" },
            "label": { "type": "string", "minLength": 1 },
            "attribute": { "type": "string", "minLength": 1 },
            "timeline": {
              "description": "The expected full timeline of a temporal target, segment-exact (an empty array pins an empty timeline); ordering, non-overlap and grid alignment are the ref loader's cross-checks.",
              "type": "array",
              "items": {
                "type": "object", "additionalProperties": false,
                "required": ["from", "to", "value"],
                "properties": {
                  "from": { "type": "string", "pattern": "^[0-9]{4}-[0-9]{2}-[0-9]{2}$" },
                  "to": { "type": "string", "pattern": "^[0-9]{4}-[0-9]{2}-[0-9]{2}$" },
                  "value": { "$ref": "#/$defs/value" }
                }
              }
            }
          }
        },
        {
          "type": "object", "additionalProperties": false,
          "required": ["kind", "label", "characteristic"],
          "properties": {
            "kind": { "const": "characteristicPresent" },
            "label": { "type": "string", "minLength": 1 },
            "characteristic": { "type": "string", "minLength": 1 }
          }
        },
        {
          "type": "object", "additionalProperties": false,
          "required": ["kind", "label", "characteristic"],
          "properties": {
            "kind": { "const": "characteristicAbsent" },
            "label": { "type": "string", "minLength": 1 },
            "characteristic": { "type": "string", "minLength": 1 }
          }
        },
        {
          "type": "object", "additionalProperties": false, "required": ["kind"],
          "properties": { "kind": { "const": "consistent" } }
        },
        {
          "type": "object", "additionalProperties": false, "required": ["kind"],
          "properties": {
            "kind": { "const": "inconsistent" },
            "rule": {
              "description": "Optional precision: at least one channel fact from THIS rule (name-normalised). Without it the expectation is satisfied by any channel fact, whichever rule produced it — precise pins close the false-green window where a case stays green on the wrong fact.",
              "type": "string", "minLength": 1
            },
            "label": {
              "description": "Optional further precision (requires rule): the flagged instance's label, exact. A created instance (no case label) never matches.",
              "type": "string", "minLength": 1
            }
          },
          "dependentRequired": { "label": ["rule"] }
        }
      ]
    }
  }
}
