{
  "format": "uchar-case-v0",
  "asOfDate": null,
  "input": {
    "instances": [
      {
        "label": "J1",
        "objectType": "Jutter",
        "attributes": {
          "stormtoelage": {
            "timeline": [
              {
                "from": "2024-10-01",
                "to": "2025-10-01",
                "value": {
                  "number": "120"
                }
              }
            ]
          }
        },
        "roles": {},
        "characteristics": []
      }
    ],
    "parameters": {}
  },
  "expected": [
    {
      "kind": "attributeTimeline",
      "label": "J1",
      "attribute": "stormwachtdagen",
      "timeline": []
    },
    {
      "kind": "attributeTimeline",
      "label": "J1",
      "attribute": "maandwachtdagen",
      "timeline": []
    },
    {
      "kind": "attributeValue",
      "label": "J1",
      "attribute": "toelagesom",
      "value": {
        "number": "0"
      }
    },
    {
      "kind": "consistent"
    }
  ]
}
