{
  "format": "uchar-case-v0",
  "asOfDate": null,
  "input": {
    "instances": [
      {
        "label": "K2",
        "objectType": "Kadeplaats",
        "attributes": {
          "vaarwater": {
            "enumeration": "Ruimzee"
          }
        },
        "roles": {},
        "characteristics": []
      }
    ],
    "parameters": {}
  },
  "expected": [
    {
      "kind": "attributeValue",
      "label": "K2",
      "attribute": "kadegeld",
      "value": {
        "number": "9"
      }
    },
    {
      "kind": "consistent"
    }
  ]
}
