{
  "format": "uchar-case-v0",
  "asOfDate": "2026-03-15",
  "input": {
    "instances": [
      {
        "label": "V1",
        "objectType": "Reddingsvloot",
        "attributes": {},
        "roles": {},
        "characteristics": []
      }
    ],
    "parameters": {}
  },
  "expected": [
    {
      "kind": "attributeValue",
      "label": "V1",
      "attribute": "sloeptal",
      "value": {
        "number": "0"
      }
    },
    {
      "kind": "characteristicAbsent",
      "label": "V1",
      "characteristic": "inzetbaar"
    },
    {
      "kind": "characteristicPresent",
      "label": "V1",
      "characteristic": "krap"
    },
    {
      "kind": "characteristicAbsent",
      "label": "V1",
      "characteristic": "paraat"
    },
    {
      "kind": "characteristicAbsent",
      "label": "V1",
      "characteristic": "geschikt"
    },
    {
      "kind": "consistent"
    }
  ]
}
