{
  "format": "uchar-case-v0",
  "asOfDate": null,
  "input": {
    "instances": [
      {
        "label": "J1",
        "objectType": "Jutter",
        "attributes": {
          "beschikking": {
            "constructor": "Aangehouden"
          }
        },
        "roles": {},
        "characteristics": []
      }
    ],
    "parameters": {
      "vaste voet": {
        "number": "25.00"
      }
    }
  },
  "expected": [
    {
      "kind": "attributeValue",
      "label": "J1",
      "attribute": "uitkering",
      "value": {
        "number": "12.00"
      }
    },
    {
      "kind": "characteristicPresent",
      "label": "J1",
      "characteristic": "bevoorschot"
    },
    {
      "kind": "characteristicAbsent",
      "label": "J1",
      "characteristic": "afgehandeld"
    },
    {
      "kind": "consistent"
    }
  ]
}
