{
  "format": "uchar-case-v0",
  "asOfDate": null,
  "input": {
    "instances": [
      {
        "label": "J",
        "objectType": "Penningrecht",
        "attributes": {
          "aantal_aangemelde_vondsten": {
            "number": "4"
          }
        },
        "roles": {},
        "characteristics": [
          "hardheid_toegepast"
        ]
      }
    ],
    "parameters": {}
  },
  "expected": [
    {
      "kind": "characteristicAbsent",
      "label": "J",
      "characteristic": "penninggerechtigd"
    },
    {
      "kind": "consistent"
    }
  ]
}
