{
  "format": "uchar-case-v0",
  "asOfDate": null,
  "input": {
    "instances": [
      {
        "label": "V1",
        "objectType": "Vondst",
        "attributes": {
          "grondwaarde": {
            "number": "0.00"
          }
        },
        "roles": {},
        "characteristics": []
      }
    ],
    "parameters": {}
  },
  "expected": [
    {
      "kind": "attributeValue",
      "label": "V1",
      "attribute": "korting",
      "value": {
        "number": "0.00"
      }
    },
    {
      "kind": "attributeEmpty",
      "label": "V1",
      "attribute": "nettowaarde"
    },
    {
      "kind": "consistent"
    }
  ]
}
