{
  "format": "uchar-case-v0",
  "asOfDate": null,
  "input": {
    "instances": [
      { "label": "J1", "objectType": "Jutter", "attributes": {}, "roles": { "vondsten": ["V1", "V2", "V3"] }, "characteristics": [] },
      { "label": "J2", "objectType": "Jutter", "attributes": {}, "roles": {}, "characteristics": [] },
      { "label": "J3", "objectType": "Jutter", "attributes": {}, "roles": { "vondsten": ["V4"] }, "characteristics": [] },
      { "label": "V1", "objectType": "Vondst", "attributes": { "waardering": { "number": "4" } }, "roles": {}, "characteristics": [] },
      { "label": "V2", "objectType": "Vondst", "attributes": { "waardering": { "number": "6" } }, "roles": {}, "characteristics": [] },
      { "label": "V3", "objectType": "Vondst", "attributes": {}, "roles": {}, "characteristics": [] },
      { "label": "V4", "objectType": "Vondst", "attributes": {}, "roles": {}, "characteristics": [] }
    ],
    "parameters": {}
  },
  "expected": [
    { "kind": "attributeValue", "label": "J1", "attribute": "aantal gewaardeerde vondsten", "value": { "number": "2" } },
    { "kind": "attributeValue", "label": "J1", "attribute": "vondstwaarde", "value": { "number": "10" } },
    { "kind": "attributeValue", "label": "J1", "attribute": "gemiddelde vondstwaarde", "value": { "number": "5" } },
    { "kind": "attributeValue", "label": "J2", "attribute": "aantal gewaardeerde vondsten", "value": { "number": "0" } },
    { "kind": "attributeValue", "label": "J2", "attribute": "vondstwaarde", "value": { "number": "0" } },
    { "kind": "attributeEmpty", "label": "J2", "attribute": "gemiddelde vondstwaarde" },
    { "kind": "attributeValue", "label": "J3", "attribute": "aantal gewaardeerde vondsten", "value": { "number": "0" } },
    { "kind": "attributeValue", "label": "J3", "attribute": "vondstwaarde", "value": { "number": "0" } },
    { "kind": "attributeEmpty", "label": "J3", "attribute": "gemiddelde vondstwaarde" },
    { "kind": "consistent" }
  ]
}
