{
  "format": "uchar-case-v0",
  "asOfDate": null,
  "input": {
    "instances": [
      {
        "label": "W1",
        "objectType": "Wachtpost",
        "attributes": {},
        "roles": {},
        "characteristics": []
      },
      {
        "label": "W2",
        "objectType": "Wachtpost",
        "attributes": {},
        "roles": {},
        "characteristics": []
      },
      {
        "label": "J1",
        "objectType": "Jutter",
        "attributes": {},
        "roles": {
          "toegewezen wachtpost": [
            "W1"
          ]
        },
        "characteristics": []
      },
      {
        "label": "S1",
        "objectType": "Strandjutter",
        "attributes": {},
        "roles": {
          "toegewezen wachtpost": [
            "W2"
          ]
        },
        "characteristics": []
      }
    ],
    "parameters": {}
  },
  "expected": [
    {
      "kind": "characteristicPresent",
      "label": "W1",
      "characteristic": "bemand"
    },
    {
      "kind": "characteristicAbsent",
      "label": "W1",
      "characteristic": "onbemand"
    },
    {
      "kind": "characteristicAbsent",
      "label": "W1",
      "characteristic": "strandbemand"
    },
    {
      "kind": "characteristicPresent",
      "label": "W1",
      "characteristic": "strandvrij"
    },
    {
      "kind": "characteristicPresent",
      "label": "W2",
      "characteristic": "bemand"
    },
    {
      "kind": "characteristicAbsent",
      "label": "W2",
      "characteristic": "onbemand"
    },
    {
      "kind": "characteristicPresent",
      "label": "W2",
      "characteristic": "strandbemand"
    },
    {
      "kind": "characteristicAbsent",
      "label": "W2",
      "characteristic": "strandvrij"
    }
  ]
}
