{
  "format": "uchar-case-v0",
  "asOfDate": null,
  "input": {
    "instances": [
      {
        "label": "V1",
        "objectType": "Vlucht",
        "attributes": {
          "datum van vertrek": {
            "date": "2024-06-15"
          }
        },
        "roles": {},
        "characteristics": []
      }
    ],
    "parameters": {
      "STANDAARDTERMIJN VOOR RESERVERING": {
        "number": "3"
      }
    }
  },
  "expected": [
    {
      "kind": "consistent"
    }
  ]
}